{
  "access": {
    "captured_at": "2026-10-18T13:56:26.786993+00:00",
    "credential_digest": "sha256:b27033322a421fcdbf7c8a2f5347a34715a37b1798c3bda1cf1dd39e781909a3",
    "credential_source": "file:path:29f247d18d3c",
    "errors": [],
    "execution_host": "mac.lan",
    "identity": {
      "id": 6,
      "username": "spyroot",
      "web_url": "https://gitlab.dcloud.run/spyroot"
    },
    "kind": "gitlab_access",
    "observed_capability": [
      "identity_read",
      "target_read"
    ],
    "origin": "https://gitlab.dcloud.run",
    "schema_version": "1.0",
    "skill": {
      "algorithm": "sha256-tree-v1",
      "consuming_project": {
        "commit": null,
        "source": null
      },
      "digest": "86eeff94d94240f04cad123064ac6cb233cc47182f66a2f685c4f010cd9cfda1",
      "file_count": 203,
      "functional_digest": "6e940688a3c787ca63728040f5445ec95376b6b6b240a456d420ecad406da080",
      "revision": {
        "source": "installer_record",
        "value": "6ca1d7778d07c417815618452b3dbee96170e8d5",
        "verified": true
      }
    },
    "status": "PASS",
    "target": {
      "full_path": "hott/test",
      "id": 123,
      "kind": "project",
      "web_url": "https://gitlab.dcloud.run/hott/test"
    },
    "target_file": "path:a9d3a059049d",
    "target_source": "project;argv:--project"
  },
  "captured_at": "2026-10-18T13:56:32.962402+00:00",
  "changes": [
    {
      "at_seconds": 3.029,
      "pipeline_id": 3917,
      "status": "success"
    }
  ],
  "choices": [],
  "complete": true,
  "continuation": null,
  "elapsed_seconds": 3.029,
  "errors": [],
  "execution_host": "mac.lan",
  "filters": {
    "pipeline_id": 3917,
    "project": "hott/test"
  },
  "kind": "gitlab_pipeline_watch",
  "polls": 1,
  "records": [
    {
      "depth": 0,
      "jobs": {
        "by_status": {
          "success": 5
        },
        "total": 5
      },
      "pipeline_id": 3917,
      "project_id": 123,
      "status": "success",
      "via": "root"
    }
  ],
  "schema_version": "1.0",
  "skill": {
    "algorithm": "sha256-tree-v1",
    "consuming_project": {
      "commit": null,
      "source": null
    },
    "digest": "86eeff94d94240f04cad123064ac6cb233cc47182f66a2f685c4f010cd9cfda1",
    "file_count": 203,
    "functional_digest": "6e940688a3c787ca63728040f5445ec95376b6b6b240a456d420ecad406da080",
    "revision": {
      "source": "installer_record",
      "value": "6ca1d7778d07c417815618452b3dbee96170e8d5",
      "verified": true
    }
  },
  "status": "PASS",
  "success": true,
  "summary": {
    "error_count": 0,
    "record_count": 1
  },
  "target": "https://gitlab.dcloud.run",
  "target_source": "project;argv:--project",
  "tested_revision": "6ca1d7778d07c417815618452b3dbee96170e8d5"
}
